speaker_tag	text	sentiment_score
2	Yeah. So so you go or he dropped it joint so somebody I'm gonna listen to the rest of this and then we'll talk about that next episode. But in that man, that's it has been in line town. Episode 18. We appreciate everybody that continue to listen to us again on your favorite platforms. We appreciate all the support. We are going to keep everything going and and we do not have a a secure name yet. But I think an anime podcast is brewing with some other members of g. I, so, like I said, we love to take over the podcast game anything that you want. I think that we pretty much got everything covered got Sports covered got music covered. We got Lifestyle Fitness. Every we got talking shit about these lames on YouTube cover we bout to have a debate couple about their everything cover failed everything cover. So we appreciate everybody that supports every single thing that we do G is going to continue working. It's gonna be a crazy 2019 for us. And again, we wouldn't be where we are if it wasn't for y'all. So again, I appreciate everybody and I can't say that enough. Other than that man flocking on any final words before we close this out.	1.0
1	I'm an just keep listening to what you want to live. Into like I say all the time music is always subjective and let the opinions be your pants if you like it bump that shit, if you don't skip that shit, we live in America baby. We got that right now.	1.0
2	There you go. Just don't come to me about how you don't like something I like. All right, because I don't care. Okay.	-1.0
1	Oh, yeah, feel free to feel free to tell us that we were wrong and some of the producers we picked was trash and all that shit like something like feel free to do it.	-1.0
2	True true with that being said man. This has been enlightening sounds episode 18. We will see you all. All next time for episode 19 this menu take JT the Donna leader of the flock and we gone he's faced.	1.0
