speaker_tag	text	sentiment_score
2	Welcome everybody to another episode of bucking stock news podcast powered by two Bulls performance feeds Thor this this episode may be a little different kind of interested talk a little bucking horses.	0.0
1	Yeah, for sure. So our guest today is the owner/operator of Bridwell Pro rodeos Tim Brig. Well, how are you? I'm good.	1.0
2	I'm good. Thanks for having me.	1.0
1	Oh, no worries. It's kind of going to be learning experience for us all.	1.0
2	That will then in the horse deal for a very short time like a short six months.	0.0
1	Is that how long you had them probably?	0.0
2	So yeah, it's my fire got put out real fast.	-1.0
1	But anyway, so so you you guys are recent on on the the Bridwell card, correct?	0.0
2	Yeah. So for to give you a little back story I was a Bull rider not a very good one. I wrote both, you know through high school and college and instead started and I guess I bought my Pro card in 96 anyway, and I rode around and got on lot of balls on the west coast. What it what had happened is I do to getting beat up and Andrew and stuff. I kind of had to give it up yum. I was only 25 or 24 when I quit But I threw getting on a lot of bulls out here on the West Coast. I became friends with Don Kish and getting on his balls all the time and go to go into their rodeos when I got beat up real good. The last time I guess 99 there. I he he called me when I was in the hospital and get offered me a job to come out and weld for it. Well, I was beat up and like I said, he beat up enough to where I can. I couldn't do too much like couldn't lift too much or do too much buddy buddy called and we had been like I said friends before need any dawn said would you like to come home and and weld for me? I'm trying to build this feed lots of these bulls. And and all I had to do is set in well, you guys are probably familiar with putting up pipe and cable fins. And and so I just had to set there and weld them the Milliron on the post to run the cable through and so on that that winter I came or well, I got hurt at Fort Worth. So it was about this time of the year anyway, and that came home and welded for dog. Well, anyway, it evolved into going to work for he and John crowning and and I work for the rodeo company therefore started in 99 and started, you know, discontinued helping Dawn with bulls and then really started getting involved with the horse part of it. You know while working for the rodeo company and then No.5 John offered me an opportunity to buy into the company and by the horses from the company which Saudi I did definitely at the time they they provided the horses and Don had two bullets on the ground. Right? Right. That's exactly right. So John own on the horses and then Dawn on the Bulls and then John also on the time of in cattle. I guess. That's anyway. and so through working around there for four or five years there and I started flanking the horses I guess and probably like oh three and then again just got an opportunity there and bought the horses and oh five and and then kind of well, I don't want this to sound wrong. But you know the horse program when I bought it and I'll five it was it was struggling, you know, there was I think there was a couple or three maybe horses going to the final and and and not a real real and I don't want this to come across like I'm saying anything derogatory. I'm not I'm not I'm just kind of trying to lay out the facts the breeding program. For the horses wasn't real organized. You know, there was kind of not sure what calls were out of what two mares. You know, there was some paperwork loss. You know, it's kind of a oh, yeah Club not a real not a real organized situation and not hey and not to say that I don't feel have some hiccups here and there today. I'm just saying, you know five it was in there was a lot of I did all the information wasn't there. But anyway, So then what I did is, you know first thing I did when after buying the horses sorted up the mayor's kind of got the you know, the mayor's that I thought were the best Mayors and certainly as we all know if you raise bucking stock you the ones you think that are the best at the you know, your first year or two into it, maybe they're not the best and and and then the one that you're that you don't breed all the sudden, you know later on you wished you kick yourself in the butt and think gosh. should have been breeding them are you know, she she was at first maybe wasn't the shiniest one in the herd, but you know, they stay hooked and they stay you know, they just stay solid and today that's the one thing I've learned now being, you know, whatever 13 years 14 years into this but one thing I have learned is the ones that are solid and consistent for me the mayor's that do that seem to be the ones that raised the better horses the that they've The Bucks in them. They're just they maybe aren't the most talented but they give it to you every time they might only be in 1819 pointer. But if they do that out of her time, that's probably in my experience that's you know, only 13 14 years into this pretty Limited in the horse industry because you know, you think of them other guys, I was talking about earlier. Oh, yeah, you guys that there's there's like guys like a cork. Oh they've been doing this 50 50 years, you know, so so when I talk about 13 or 14 Teen years. I might my experience is a little bit limited compared to those guys obviously, but in my limited amount of time here going back to what I thought the solemn are the ones that just give it to you what they what they can every time and and do something every time 1819 Point hoppers for me. Those have been the ones that have been the best moms, you know, and I don't know why that is. I wish I had a magic ball to look into and figure out why that is but But you know the the the ones that jump out there and just make your mouth water rank as hell one time. And then the next time maybe aren't as shiny. They the consistency it for whatever reason that that genetic trait of consistency doesn't doesn't carry on to their you know, their Colts have that same enemy. You know what they're just not consistent in any way so that send the Colts out of those.	-1.0
1	Distant horses tend to outperform their mothers in the arena. I would word of it out.	1.0
2	I wouldn't say necessarily outperform but the consistent mayor's brain trays you fucker they raised in something, you know, and yes, I have I have some errors that yeah, they're there. I'll give you an example. I had a little old mare 124 her name is classy cat. And so that married be like how she be 18 now, but every cult we've got out of her box there and like to some degree like whether it's shining really in a far potential or dis good, you know, and and in fact, I don't think I have one that's went to the NFR yet, but I got a couple cold. That sure look like they're suspects it just matter of whether they stay healthy and and continue on what they're doing. But but she was probably only I'm in today's world. I would say she'd struggle to be an 18-point her. She was just a hopper. She had cool a cool style. She just wasn't that shiny, you know, and but her cult certainly outperform her that's that's for sure. But at the same time You know, she wasn't very big or was it still have her so she isn't very big and and and just not very talented. You know, it's sort of like a like a football player, you know, if you're not that big and strong it's pretty hard to be very good at it. Yeah, but but he cried but big doesn't doesn't things with her and she's yeah those coats are showing up pretty good, you know, so so in 2005 kind of when you took over the whole deal what What was the stud that you put out and how how to his cult perform? Well the first the first year so okay, so I bought the horses in the fall of o5. And so the actually the mayor's were already bread. So I didn't really make a stud decision until the spring of o6. The spring of o6. I went and I leased a stud and I am so thankful. For that now I went back and I kind of I was kind of a little bit rough earlier when we were talking about how that some of the old-timers are and when I say Old Timers, I mean the the established bucking horse programs. They didn't they weren't really willing to share intellectual property with you and they were pretty pretty quiet and tight-lipped about what they were doing. Well, I was very lucky. I become friends with with the Sankey family and in the spring of oh sick. Exile East a stud from Ike and his name was star belly sneech and so star start at least it was just kind of okay, but he wasn't that good of a boxer himself, but he is Mom was Cindy Lou Who and Cindy Lou Who who was among a really famous mayor. I had that went to the NFR bunch of times and she was a daughter of Custer, huh? I believe I don't have a pedigree chart in front of me, but is if I may Serves me correct correctly Cindy Lou was a it was an own daughter a Custer and and then that sire to Star belly sneech was a stud of cork owes name confused velvet and he was and he was a really good sire. Like they had a lot of luck with that horse. And so anyway, I took start releasing each and brought him to the mayor's like I told you guys earlier that I thought were the best. You know of what we when I had bought from from them guys and when you say that you mean like the best as far as bucking horses are the best that you thought would be the best broodmare type forces. Well a little of both right? So what's the one thing that I did also a little bit different when I first started I knew I was behind the 8-ball little bit and all five or o6 when I first put this done out with the mirror. I know I was behind me. ball as far as in terms of I told you guys earlier that the breeding program that that I bought, you know wasn't real organized completely mined out on what what matters were produced and what stuff for the what and got out of it was just kind of just a bunch of horses really and so what I did is started, you know, but, you know, obviously with bucks who we had all our old mares and boxes and stuff, but then I went to bucking some young mares and and doing some stuff that way and then I started breeding some young mares like some three and four-year-old Billy's to to try and get ahead of the curve and it wasn't that I wanted to turn those those fillies in the broodmares at all. That wasn't my intent. It was just to get a cult out of him to get to get ahead of the game a little bit and and and and I use you know, a couple things, you know to decide number one was obviously Secondly was was the you know the pedigree of the mayor but but again, like I told you that wasn't completely organized. So it was kind of kind of kind of sorts to navigate through that but then the other thing was confirmation, you know, I talked a little bit ago about classic at one of the one her problems was why she couldn't Buck any harder or be any better than she was just for confirmation. She was too small and built a little bit wrong. To be to be really rank, you know are really good. So, you know, you can almost look at a horse and see what how is Styles going to work? You know, how he's going to block? You know, a good example is Butler's you know, Benny Butler you guys are familiar with that and I'm sure everybody knows Benny Butler Rodeo business. Well, they're there the way their horses are bit built their big kind of lanky kind of raw. Bone horse. And they got usually a highway others, you know, and they're they're just built to where you know, they're going to be dropping they're going to Buck hard and they're gonna be dropping and they're athletic they're really built that way and and so that and so in terms or in turn built any does have a lot of stronger horses that will turkana guy and Buck Em Off. Yeah, I mean and but they also can be 90 on them, but they're just they're built that way then on the flip side of that you can go and look at Like Kirby's heard in Utah the Kirby family their horses are a little bit smaller not as high withered little more kind of I don't want to sound say I'm wrong because I don't want to be like I'm down on them because they're awesome horses. They're just kind of like a little fat horses, you know and very little and so because of that because I have some of them to they Hawk they're really the guys because they're little bit. They're not as They're not built to be strong. They're you know, they're really effective and they have cool Styles and they're really flashy but they're not going to they're not going to block anybody off because they're just not built to do it. So yeah, that's that's certainly a big component in the bucking horses deal is is the confirmation, you know, you have obviously the pedigree but the confirmation means a lot that's interesting. So you said that you were namely blessed to get that stud. I mean it was where the first set of Coach really good or how to pan out.	-1.0
1	Well, so yeah. No, I mean I'm not going to sit here and say they're the best ever but they were awful good like well one cult in particular I actually sold in the security and I think it was like 2012. Well, it's see I would have been 2012. I sold a horse. Pony man, he belongs to stay Smith now and he was he was out of that cult crop, you know, and then there was you know, he was by far the shiniest one. I mean, I guess I sold him to stay. I'm pretty sure it was 2012. He bought him there at the Benny Binion sailed, you know the bucking horse or a bucking horse security actually stays puts it on and and yeah, so Smith, I'd buck that colt there and Smith. Bought him and I think he's been to the NFR every year since like, oh, well, yeah, he's he was the shiniest one by far and then oh, I have a few other ones that are just really nice horses, you know that route. And so I think that first whole crop, but probably had well I'm going to say I can't I don't recall but I'm gonna say between 15 and 20 Colts to start with and I'm about I have when do you start those horses? I'm sorry to interrupt. Sorry to interrupt. Wendy's start those horses, you know, how long is it before you start to know if you made the right breeding decision? Oh, well, sometimes a level five years, but for that particular to answer your question directly, the first part of the question was, you know, when do we start a I start dummy are blocking the Colts when they're too and and and I just dummy buckham once when they're to unless they just flat run off if they just flat run off. Then on my block him again, you know and do something a little bit different just but I bought them wants when they're two or twice. Like I said and then same when there's three and then so then when therefore I get people on them, you know, they start with their Riders. So a lot of them a lot of them horses have anywhere from two three, maybe four trips by the time they're four year olds, and then then it's time for a rider and and sometimes you know, they They you know, if you can see that they're pretty sure of their feet and their they have a really controlled style and they're you know, they're when I say a controlled style, you know, like the akkad. I got a pattern and they're like I said their feet are running room and all that's going on good and I feel confident. I'll stay up and not fall down with the guy. So I'll go ahead and put a guy on him with a couple of dummy trips and then and then the other ones, you know, there's those horses that I've Listen, I hate to admit it but there's horses. I've raised it. It took six or eight trips to before I felt confident to put a guy on it because it was all down all of ya and and generally that's the wild or wasn't it and going back to the breeding. That's when they're bred wrong. They're too wild and you know bucking horses. Sometimes the the Layman fan gives bucking horses a bad rap like they're there and I shouldn't that sounds wrong. I got I wish I could I was better with my words, but They get kind of a bad rap like her wild and yeah, you guys know that's that's not the case at all. Some of these some of these horses are really gentle and really good to be around and and and generally speaking is the more quiet they learn calm. They learned Focus. They are the better bucking horses. They are they you know, they don't have to be Wild Buck. We all know that what a maybe this is a silly question, but I'm not a bucking horse guy got on some back in the day and never never did any good at it? Didn't ever understand it but aside from just sighs. How do you how do you choose which which event you want to Buck those horses a cracker or saddle bro? Yes. That's a really good question for me. First of all, you're going to see when you dummy block them kind of what they do with their head. And when I was talking a minute ago about the control their body control while there while they're bucking with just a dummy on that gives you a little bit of an indication of what event to do to put them in. in butt butt For me, I found more of their mother. So if their mother could take the bronc riding and tolerated it and she liked it and bucks in it. The Colts in seems to do that, you know, tools will follow suit now that's not always the case but a lot of the time it is, you know, an in an unfortunately the way as the way the rodeo business is now with the shorts. Age of bareback Riders, sometimes you are forced to put Colts in the bronc riding that you're not 100% sure if it's going to work or not when you're first blocking them around but sometimes there's it works out beautifully. Sometimes it doesn't but for the most part you kind of got a number one go with their style number two kind of their mom and then third the availability of the riders that are there that day you have very many of those horses that you may be starting. In one event and then decide that they need to go to the other event, or maybe they do both events or oh absolutely. So so I have a horse named Capone and he's been in a far five times. I think or maybe six and his mom is out of one of our famous men as Raggedy Ann. Well when I first started bucking Capone, he was a bare back and he went to the finals like for three or four times and bareback, you know in the bareback riding.	1.0
2	Like I said and then	0.0
1	What happened was he kind of started moving out started covering too much ground getting a little bit long and away and then and then we moved him to the bronc ride, you know, heck he never even ever got bucked in the bronc riding until he was probably, you know, seven years old, you know, so we're so eight years old. Maybe I can't I'd have to you know look back but but yeah, no he went to the finals again in the bronc riding. Yeah, actually, yeah, he's been as though you know, he been in the finals. I think he went man.	-1.0
2	I wish I could remember I think he went I know he went a couple three times anyway in a bareback riding and then it only went twice in a bronx and the first year he went in the Bronx actually feeling Crawley one second and on him in The Eliminator pin that he wanted second that one round that one night and then then he went last this last night and 18, but he went and teen again, but then it came out that and was Zeke's arson and I think of zika gone anyway, and I didn't even got in flank and they jumped off I think and got to reroute a river. But but he so it came out backwards. And so it was kind of a mess that you're in 17 and then they didn't he didn't go back and this year and 18. He still box really? Well, I'm not I'm I'm not trying to say that, you know, like he's killed us really really hard. He just didn't go last year in you guys know how that goes some years. They need they need more of one kind and another and you know, this is how it goes. He just didn't get chosen last year, but he still as good as he was these this these people I'm going to mention here their long ways from you, but you probably you may you may know this the answer to what I'm going to say to correct me but to go with what you're saying Thor and some good friends of mine that live over there by you the the gays that horse is salt. They he went to the finals of bunching in the bareback riding and I'd never seen him in the bronc Ridin till this year. Did he go in the bronc riding him this year to the final? You know II could look but I don't recall seeing assault there, but I know him he's that Buckskin gilding. You're like, he's a good horse. Yeah, I don't know I could you know what I can look real quick cuz I think I have the NFR left right here in the go in the old. I remember seeing them. They took him to I think it was luck in in in the Bronx grab your maybe Amarillo and I was I had to watch that video a couple of times thinking is that the Assault that I think it is. Yeah, yeah, and and and and he's probably the same the same. Same scenario as I was talking about with Capone, you know, he's been a good bear back for a long time. But if they start covering a little ground and stuff.	-1.0
1	Oh, yeah, he went to the end of our here. He is right here on the list.	1.0
2	He and three Bells went from rafter G. But yeah, so yeah sometime later on in life.	1.0
1	They just got it. I started covering too much ground and not doing doing things right. We got to move them and that's just that's that's good night about the bucking horses compared to the Bulls is	-1.0
2	You can do things with him to kind of keep him bucking like like that. You know, if the bareback rider they're not showing you what you need to see you. You still got the bronc riding, you know in the bull rule if the Bulls quit, you know, where do you go from there? You know, that is that's something that maybe some people listening. They may not know a difference to in the horse deal you guys Buck your mayor's as well as your studs and galvan's verses in the bull deal. It's only the Bulls. Well, absolutely. Yeah in fact T' are our best horses are mares. I mean, there's good. I guess I could I don't have numbers in front of me. But I would say the biggest percentage of our heard that's of the higher-end horses are the mayor's you know, and you guys can book them heavy bread too, right? Yes. Absolutely. You know, you don't want to Buck him right up to the end. But but like a good example of For a how our system earlier in the conversation I mentioned how I learned a lot from Ike's Anki and one of the things that I learned from Mike was with breeding young mares and then breeding your business. Let's face it guys. It's if you don't breed your best mares, you're not going to have good Colts. You're gonna have mediocre cult. So you gotta break your best married.	-1.0
1	Well, so how long does that take them out of the Arena?	0.0
