speaker_tag	text	sentiment_score
2	I agree. I agree. I mean looking back at you know, my life just long so far, but when I look back in my life, you know, I know there's times when I wasn't the best person I could be you know, and any and those those moments, you know, if you know, you can't redo them, you know, there's times when I have been unkind I have either verbally been unkind or I've mentally been unkind and both of those things are you know things as humans, we you know, we got to deal with we got to recognize it but hopefully learn from it as well. And so, you know as we notice unkind things because it's going to happen in the classroom. We're Notice on kind things. Hopefully, that's the takeaway that students can can learn as yes, you know, this happened and and showing them how that's not the person they're going to want to grow up to be right. That's not the person and and when they can look at you you teachers out there and see that person who they're going to want to walk in your footsteps and hopefully that's the takeaway from today's episode.	1.0
1	Yeah. And I know you mentioned like there are things we can start doing now and that's really it just just beat that example. I do want to say as we gear up towards yellow days not until May right but Deedee you said it best like why wait till then start some things now and I think we've covered quite a few things my favorite part about this kind of talk to is that when I do this talk or this this conversation as a keynote when I go out and speak to schools. My favorite part is just seeing people now their heads, you know, like yeah. Yeah, that's a great act. Like I already do that and that sincerely that's my hope that These are things people are already doing maybe that's just reignites your idea that come across has try that or maybe I can do this for my students know really busy in the classroom.	1.0
2	We think of all the things we need to do and you know it, you know, like my resting face is not a good one. I'm just going to say right so I mean being aware of that or my thinking face know I'd had students got missiles. Are you mad I'm like no. I'm just thinking, you know, but it looks like a mat that is all looks the same sometimes but you know, we just be kind of aware of that we But we have a big to-do list as teachers, but I think at the top of that list should be make really good human beings.	1.0
1	I like that. Yeah, so we have a website going make someone's day yellow.com some of Didi and eyes amazing friends have shared some free products out there that on that site that you don't need to wait until yellow data use, they're just ideas about Sharing kindness and creating kind atmospheres in your classroom, I guess and just making the again. This is just about making the world a brighter place for other people. And by getting people to see the good inside themselves. So check that out and the best part about this is I've learned so many wonderful ideas from people like DeDe and another teachers who have come back and said, well we did this for the other day. We did this real day. We're doing this to gear up for you today. So, please please please as you share it this episode or share talk about this with your teachers share those ideas with us, you know, if you put something about kindness on social media that is related to to making the world brighter tag Didi and I in it and we want to hear your ideas to in. Yes, yellow day. Obviously, it's not my personal ID at all. It was it was a team idea that we started at our school. Obviously the books are my ID. And what I've done with the so far has been a culmination of ideas. I've learned from people. So yes while it's tied back to my name. I guess I don't want it to be that way at all. I want it to be a worldwide Global thing. So ours right is it's ours and I want those ideas to be spread and shared. So we love I say we because it is a community people that work this together. We love Of hearing ideas of ways to make make the world a brighter Place awesome.	1.0
2	Awesome. That's a good spot to end.	1.0
1	Is that that let's do it. Yeah, so be kind and we'll see you next time guys.	1.0
2	All right. Thanks. See you.	1.0
