speaker_tag	text	sentiment_score
2	Well, so are the way our schedule works is, you know, obviously if Some of the NFR then we don't do anything until the end of March as far as rodeos are concerned. I don't go to Texas or anything like that. I just use a stay home and Buchholz and do that kind of thing for how my program works is I will I turn to start out March 1st. I leave I leave our studs out for 45 days to 60 days depending on you know, how the weather you know, like I If there's like a feel like they've got two good Cycles. in then then that's when I pull them if if I don't feel like that then in I just I anyway I just want to make sure that I get them covered and I try and do it within two months if I miss if the stud Miss isn't there, I just absorb it and I don't worry about it because I don't need Colts too late because again, it could screw your deal, but I messed up my schedule because I booked the mirrors that I breed and and how I do it is so A good example is like wild and blue and tnf are just a couple of months ago or three months ago, whatever it's been now and she had a cult couple days ago some so she you know, so the turnaround time is so she's bucking the pmf are you know, eight and a half nine months bread. But then she'll she you know has these this winter off. She has her Colton case. I live in California. It's pretty nice where we live it's cold right now, but for the most part it's not too bad in the winters. She'll have she'll have, you know have her cult usually and February or 1st of March and then I will only leave the Colts with the mayor's from Fort same deal as the as the breeding cycle 45 to 60 days and then I and I ween them called too young and I A month as much hay as they'd like as much like they have free choice Alfalfa and then I feed them grain and cast Mana to get them going and and it does two things. It gets my mayor back on the road so I can get a rodeo on again. But it also makes you cold it's good to be around and pretty gentle. So, you know, they come they come to feed and and and they get used to being around people. So they're not they're not real wild went for later on and and then they don't get a little go ahead you obviously they get free choice Alfalfa and good feed but you don't have a problem with them growing just like from not being with her mom. Actually we've done it we've done a test because you've had I've had that question happen a lot and I've actually had the cult that Our on on hey and calf man and grain outperform the Colts that are on the mayor still I'll be done. Yeah, and and I think that's because we don't know how much milka mares producing you think, you know, but you don't know how much the calls getting and and so, you know, it's no different than the cow-calf deal the cow-calf guys, you know, you'll have Pals that always bring in a calf at a great wing and wait and then you got not count bring in a calf with a very good weaning weight. So you just can the cow or whatever they do and get a different cow. Well, it's not that way in the Bucking Horse World where you don't just because America doesn't produce good milk. That doesn't mean we don't want to keep raising cold side where we just going to find a different way to take care of that baby and get big and strong because you know, the maternal ability might not be there on that matter, but the Bucks in them, right? So we got to kind of and going back to what we were talking about earlier this Rocking horse deal isn't like the Bulls deal. You know, it's it's a lot harder. I mean that they just they're so there to get a really shiny bucking horse. It takes a lot of lot of breeding and and a lot of luck and a lot of work. We're in the bull deal. I don't I don't want to discredit the bull deal because it's and say that it's easy. I don't mean it like that because it's hard as well because you only get like half your cash crop, but at the same time You can go and and you know breed Mudslinger to a Houdini daughter and you're gonna have a pretty good chance of a cast that box. I mean pretty good chance, you know, sorry.	-1.0
1	Do you say someth or oh, I just think I think you're absolutely right, but it's I think it's a lot like the horse deal every day more and more. We're bucking females. And and I think you're right. I think you could breed, you know some Superstar stuff and have a pretty good shot, but I think	1.0
2	So they're pregnant for 11 months 11 days. Wow.	1.0
1	Yeah.	1.0
2	So so you're about a year out usually, you know, if and then and that's if that if you know if the stud gets her right away when you turn him in, you know, so and and you know, it is I don't know so that but I like like I said II usually March 1st is when I turned them studs out and out here in For Nia and it's always generally speaking. It's pretty nice. And and the you know, we don't know how that the sunshine in the weather and the warmth and all those things gets gets gets the mayor cycling better and and then so if everything goes right, usually I can use they start getting those mares breads are the first week or two of March and then that you know that gets me the February babies that I'm after so and then after they have their faults, how long is it until you can put them back on there? Well, so generally speaking Yeah, 45 to 60 days. All we know is cult and put them on.	1.0
1	Like I said the full feed deal then then but in the matter of a couple of weeks to recover to you know, you got they got to dry up and then they and then you gotta kind of exercise going to get them in shape a little bit to you can't you can't just you don't want to just take them in there with you know with a big bag full of milk. They'll be you. Do that to him. You gotta let him dry up. Like I said and get their belly kind of shrunk back into shape and just kind of get them back into shape. And you know, it'd be no different than your saddle horse you if you need to get some work done on your saddle horse. You don't just let him stand out six months and then just go get on pounding back into very good. He'll probably just tie up on you, you know, so so a couple couple more horse questions for we dabble in the	-1.0
2	The bull side of things for you guys. How many how many murders do you you guys breed a year?	-1.0
1	We usually exposed what we've been doing lately. We used to expose 25 to 30 of them depending on you know, a couple of things just how well I like the young men remember a little bit ago. I talked about exposing young fillies, you know for three four year old Phillies. Well, depending Come on, how many I want to put in those into the system for you get a cold out of so but to answer your question directly. Yeah, 25 to 30 of them. And then generally that means that you'll get you know, they'll they'll be a few measures that don't get bread. So you'll I usually shoot to have 20 calls a year at least 20, you know 22 you'll end up with so if you exposed 30 mares, ideally you'd get 30 calls, but generally speaking you're going to get 25 or 26 right in that area and then and then same same deal as finally read exposed 25 meters. It's more like, you know, you know right around 20 to 21 22 and then there's been years like I Beretta I studied calvary's a couple years ago. Tiger Warrior actually, he's are really really great blocker and really bread well and when we breath tiger Warrior, I put him with 20 mares because that was the deal we made. Made with those guys and heck. I think I only ended up with 13 goals. And that was it that wasn't tiger Warriors fault or anybody's fault. It was just one of those things where that was year was real wet and rainy and and not lost sunshine and the mayor's didn't circled. I'm sorry didn't cycle that well, and and so it wasn't all his fault. It was just one of those things that have Mother Nature. Yeah, exactly. And in fact, I when I talk to our vet around home here, and he said he was having trouble. Even getting like the cut and horses and reining horses in the people in the with the saddle horses around he was trying to having hell getting a the mayor's ovulate for him, you know, so it was just one of those Springs. It was just a tough.	-1.0
2	It's crazy. You say that I pray break. Some cows has this winter and my vet when he called them, you know, he dragged him and then afterwards he said, you know, it's funny. We've Craig thousand cows this year and there was they were either shortbread or long bread. But but the way he was saying it was They didn't they weren't breeding in a certain 45-day window from all over the area. You know, dude Mother Nature like you're talking right?	1.0
1	Exactly and I think we can all see that mother nature is more powerful and strong more strong than any of us, you know, you'd allowed and I love hunting and I hunt a lot in the Northwest is if I can and if we have time and you'll see that on certain years when we go elk hunting you'll look in the the cow elk. Have a lot of calves on them and it looks like everything's good. Not the populations good and then the next year, you're like, oh boy. This doesn't look good. I hardly see any cabs and and this and that and I of course there's a there's a whole host of reasons for that. You know, you got the Predators and all that jazz, but then probably some of it is the is the mother. Yeah how well they got bread back by the Bulls, you know, so yeah. Yeah. Yeah a lot of variables that play into it.	-1.0
2	So before we switch over to the Bulls, what was It's off the top of your head some horses. You guys have taken to the finals back in when you took over and o5 O 6 2 2 now like some of the famous ones you mean that that we've taken. Yeah.	1.0
1	Okay, so well, probably one of the most famous horses we take in the finals is is sock. Dancer Moulin Rouge sock answer, you know, we've sold this in them in the meantime while I start we started taking him. Think o 506 taught that that period of time and took him to the finals a few times 1 branca the NFR and it's the ear. He the year he won that actually I sold him to stay Smith and that you know, Moulin Rouge was a real famous horse. We took now beaver fever. She went for hacks you went from all five till last year and then we retired her beaver beaver fever with a heck of a good horse for us. And then and then in fact one of her sons went to the finals last year be verb and he went to in a foreigner bronc riding and then all raggedy Anne Capone.	1.0
2	What's the what's the gray mare?	0.0
1	Wild and blue? Yeah. Yeah. She's been every year since so I actually bought her from the guy here and right here outside of town a friend of mine named Chuck Norris. He raised he raised his bucking horses and does some high school college and it's Amateur rodeos and has a brief program himself and and I actually bought two members from him and I'm kind of think that year. I bought those murder. I'm gonna say I think I bought those mares from him and like, oh, wait right in there and and I bought wild and blue who herself, you know bucks bucks. Obviously really? Well, she'd been to the NF are all these years and then there was another mare that came with her and her name was His Indian summer. Well Indian summer, she's just an okay Bronk. But remember when I was talking about that consistency of being really solid she oh one of those kind she's solid. She's like a 1920 pointer every time and she her oldest cult I have is a bronc named Indian burn and I took him we've taken him to the finals the last two years. He went as a four-year-old and five-year-old. So and And I know you're playing with fire taking a four-year-old to the National Finals. But but he's just that good and anyway, so that that purchase worked out pretty good for us by an electric bears from Chuck. So, you know, we got a boy, you know a really good mare that produces Colton and one that bucks really well herself. So yeah, that's about what they sometimes it hits like that. Now I've got other stories I could tell you that didn't hit very good that one did so so kind of transition into the to the Bulls	1.0
2	Side of things you guys I'm taking it you don't you don't raise any you buy crack?	-1.0
1	Right? So again, like I told you earlier when I first came around went to work for Dawn Kish and and sure if anybody anybody knows anything about bucking bulls and those who've gone to issues and knows what he did for a lot of years and and So I worked around that outfit for a long time and you know, I learned a lot about bulls. I think I learned a lot about bubbles in it and with around a lot of bowls and a lot of cows and lot of All That Jazz. And there was a time when like in the late 90s when I first went around there and early 2000s when if you wanted really good Bulls you need to raise them. I mean, I think everybody would I think you'd be naive to say that in that period of time you needed to raise the goal is to get the kind you wanted that were that were beyond what everybody else had but as we all know through the last 15 years, it's changed, you know, the You know heck there's there's people showing up to those a BBI events that nobody's ever heard of that just flush the cow and put it with this did that and have a mother and had a really good bull, you know, I mean II am not and when I say really good, but I'm not talking about bushwhacker. I'm just saying they have both it turned back in the gate bucket or you know, 22-point Bull and it's somebody that's not really a bull person. They've just bred that way and and and not to try and get and I don't Mean it like this discredit people like they don't know what they're doing. I'm not saying that what I'm saying is it would be no different than me and going and Bryant buying a cutting horse out of highbrow cat and some fancy mayor, you know, I the Bloods there it's in them. So if you know, if you don't as long as you don't mess him up, you know, the Bulls are available and so forth for through just the supply and demand of the rodeo the kind of bulls we Rodeo with week, you know, you guys all know that we don't need both like, you know Long John rodeo with or frozen or whatever, you know, you don't need those but we just need you know, you just need good Bulls to turn back and guy can be 85 or better on and and and so for us what works when my wife Haley and I started Bridwell pro rodeo, you know and and here a couple of years ago. We just found for us. It was more cost effective just to buy the boats, you know with with raising them and that I just don't have the feed for him don't have enough country out here in California Every Little Bit of Country. I get I have to put the horses on because I can't afford to buy the high-end horses, but I can I can I can buy, you know, I have to raise those but I could I can match around and they're really good Bulls, you know, just for free.	1.0
2	Double amount of money. Yeah, like you said the supply and demand you can you can find there's a lot more people raising bucking bulls and good buffing floors in there is horses and then people damn near want to give them Wolves Away, you know, it seems like well here I'll give you an example and I'm guys I'm not an arrogant guy.	-1.0
1	So don't think it'll take a like I'm bragging. I'm just trying to say how it works for us financially and up it to be efficient. I bought a bull at the NFR sell two years ago, but we call him 100x helmets Boot Hill. Well, I guess 3500 for him at the NFR sell two years ago taking him to the National Finals twice and the other day at Sacramento PBR. They are Vieira was 89 on them want to short go on him, you know, and I know that that doesn't always work out like that. I'm not being trying to be naive either that that it always works out like that but like him or the bull jive turkey that they the other Brazilian boy rows are in the short goat Sacramento. I bought Josh Last year at the enough ourselves. I give 6,000 for him. He come from Toby Floyd and and that and he was like $89 88-89 on him a guy can put by a really damn good bull anymore.	1.0
2	Four five six thousand bucks. Well, yeah for that you have to raise that ball.	1.0
1	They had to raise five other ones. That's that's all I'm saying. It doesn't work for us.	-1.0
2	I seen some videos. As following your guys's social media and stuff that that jive turkeys. I've been a fan of jive turkey style. I was questioning why he didn't go and finals last year Oh you mean the NFR? Yeah. Yeah. Oh, he did know he did. He did go. Okay. Yeah, he did go.	1.0
1	Yeah, jive turkey went and and then I so we took him and we took who's bad news. He's another bill that came out of that sale.	1.0
2	I had to give a little bit of Jack for him though because there was a couple other guys that like him too, but All that was visible that Jamie was that win long the lot one in Long rounds on right? Yes, sir. Yeah, that's yeah, that's who's bad news. Yeah, and there was a there was a white boy. I think you took or maybe he had been before on the rights kind of move away from them guys a little bit. All right, come out Omaha the big bull. Yeah Omaha.	1.0
1	Yeah.	1.0
2	So the other day, I'm at Sacramento muhittin hip and kind of making shoot forward and had a little bit of a different day that bull usually right there to the right. You like he'll go like a round or two right there to the right in the gate and then he'll jump forward and go back a left generally, but the other day, like I said, he hit he hit his hip and made him shoot forward and then he kind of had a kind of a I don't know. I didn't love these is move before I turn back. But once you turn back then he was fine. But yeah that hit so that will Omaha. I like him. He's a good boy, but he came from a friend of ours up in Oregon a guy named Rusty Gorham raised that boy. So the in their sure proud of them Rusty and Lisa are real proud of that bull. So that's cool. Cool for that deal back here. $3,500 will 10 Bingham was like 93 on them at Kennewick or something. Wasn't he? Right? Yeah. Yeah at Puyallup at the yeah. Yeah, and then his brother Tyler at Spring Road. The only time that Bulls been rode the last couple of years. Other than that the PBR deal, but Tyler Kimball throat. Yeah, that's crazy. Yeah. Hi, you know good good good boy, the 93 I think was a stretch that was quite a bit of points. But but but he's a good-good bull and in back to our point is for for what works for our business and and I'm not saying that works for everybody. But for what we're doing it, it works better for us just to buy the both, you know, so I can see the guys that raise them like the pages I watched. They're Bulls at Sacramento. Watch what they do on the sales. And if not and how they do their their their business and I can see why they do what they do. It works. They block like hell and they sell it for lots of money. So they're doing they do you know what works for them? That's good for exactly. What so what about to you can kind of answer this in the two-part question but like us fraternity guys and stuff what kind of segregate our bulls and stuff and then I take it rodeoing, you know, it's um rodeos may have ample amounts of pain some may not Are they are they just in general population like at your house? And then how many how many trips a year roughly. We you put on a bull? Well, the first the first part of your question is is you nailed it. There's there's a lot there's rodeos have the facility that to split them up pretty good. But then there's a lot of a lot of rodeos at don't have that, you know the kind of facilities. You need to split them up a whole bunch. I'll tell you how I try and make them live. And and you guys being bull guide, you know that there's sometimes you just can't make mixes. There's some mixes that just don't work. They just don't like each other. We know we all know that kind of force them through it and get them to get along but for us how I try and do it as I pay them how they fit on a truck. So in a cattle pot sets of 6 is I got using I got a couple sets of fours or like a set of for a set of three got to be the nose and the back step and then sets Six is on the top, you know the top and the bottom decks. So and then that also fit for the pins that we have in our house, you know, we have pins that are about all half acre lots maybe from half an acre to maybe one acre lot and and that's plenty of room for them.	1.0
1	So they don't make it too muddy or or whatever, you know 7f room doing the first part doing doing it that way to with you guys.	1.0
2	Bye. Bulls you can you can at least find find somewhere where they'll get along and don't just have to put them all together. All right. Yeah. Well and I try not to mix too much with young and old that's the other thing you guys probably the same thing is if he generally when they're young and Too Young or whatever young and old this doesn't work. I try and mix bulls that are kind of in the same kind of age bracket. Not not too much because II If you get too many youngsters In Their Own Zone, you know how many Smart Ones they're all just thousands of goofy. But then at the same time I try and just do it that way. I'm not saying, you know, and I don't know there's there's mixes that you're thinking it's all right. This is a perfect mix or getting along great and then one day the fight breaks out your welcoming six and you know, we all know that that program but So that's how I how I have my set and then the sixes or so, but and then the second part of your question, I already forgot. What were the how many trips you you put on the moles a year? So, you know, we have 20 rodeos and and that includes some bull rides and stuff. So not as we all know not every bull goes to every event but generally when they go they got they get back twice, so probably around, you know, 15 to We find out it's probably early and and but remember our our season doesn't start till the end of March and it's over, you know, probably around middle of October. So we kind of so strip for pretty consecutive. It's not like we you know, you know, it's spread throughout the 12 months. We only Rodeo for about seven months out of the year. And I mean excluding you like the NFR and that kind of thing, you know, but you only take such a hit small. There, you know a handful of them on speaking in terms of the whole herd not just hand out of them, you know, so yeah with with that being said have you I mean being that you know, and I think if I'm not mistaken and maybe it's changed now, but some of the rodeos out there California and stuff they may only have rights or buying buying bulls. Have you figured that some Bulls just can't take that whereas, you know, Omaha and and Boot Hill and bad news they can take That right? Yeah, so I actually most of the bulls that you're right some of the that is one thing I've learned about the bull deal that I I did not know before is I didn't realize how important in this sounds really silly and kind of naive but I didn't realize how important the the deliveries were on on the Bulls until the last few years before I you know, I always kind of treat them like horses are pretty good about you know, they kind of take a scoot out of there and they go pretty straight for a while before they start into their Circle. Usually well with the bulls as we all know if a bull Curtis back right gate, he he's so wired and program to do that right there if the gates in his way or if everything it's hard for him that change it up if they've if they've done it done it very long a good example is is so I have a good buddy in the Northwest and you guys know him and my Quarry he has a bull call Cowabunga and so Years ago we were going Cowabunga is always out of the left and we decided he Mike's bringing the reading and reading rodeos. All right. Well, we might thought well heck we'll try and figure out how to get Cowabunga out of the the right. So we were going to we're going to running through this dry if running through and making turn out of there out of the right. We hiding tailed just dry. Nobody even there now we can it was all we could do to make that simple sucker turnout. Out of there to the right. He just wouldn't get one do it just like is the only thing that has to be spraying or something. I don't know that goofy little pot liquor. We couldn't hardly get him to turn out of that properly and finally, II think what we finally ended up doing is running around running around in and doing it until he finally kind of went out there but it kind of ran down the gate even dry. Anyway, we tried to Buck him and it didn't work and gave her a ride and all that. So going back to my original point the it's if if they've if they've been out of one delivery very long. It it's so programmed in their mind. So for me, it's been hard to switch him. But I just try and change it up when they're young, you know before when I see like when I buy up a little if you know we get to a place is only has rights and and hopefully the Bulls young enough. I see I just start changing them up right away and and make them, you know learn to do it that way now. Obviously, I have some that don't don't don't ever change like jive turkey you were talking about him and Was too a while ago, you know, he's right there to the left. He's never been out of any other delivery and he's really good. So why would I mess with it?	1.0
1	So when there's the rodeos where they only have right hand shoots Well, Jack turkey doesn't go, you know, you know, that's just a way that's got to be, you know, he and I only got a couple bulls that way but you know, he once they get to where they're pretty shiny in there and they're that good you don't really want to mess him up.	-1.0
2	Do you are you gonna are you gonna start going to some pbrs and stuff while you're slowly while you're slow time off rodeoing?	1.0
